{
  "schema_version": "candidate-dataset-manifest.v1",
  "dataset_version": "candidate-dataset-demo-cycle-013-aaaaaaaaaaaaaaaa",
  "artifact_uri": "file:///artifacts/datasets/candidate-dataset-demo-cycle-013.jsonl",
  "content_sha256": "aaaaaaaaaaaaaaaaaaaaaaaaaaaaaaaaaaaaaaaaaaaaaaaaaaaaaaaaaaaaaaaa",
  "record_count": 1,
  "feedback_ids": ["feedback-21"],
  "feedback_export_uri": "file:///artifacts/datasets/exports/demo-cycle-013.json",
  "feedback_export_sha256": "bbbbbbbbbbbbbbbbbbbbbbbbbbbbbbbbbbbbbbbbbbbbbbbbbbbbbbbbbbbbbbbb",
  "candidate_model_version": "classifier-candidate-demo-013",
  "production_model_version": "classifier-demo-2026-09-21-001",
  "frozen_evaluation_dataset_version": "demo-evaluation.v1",
  "frozen_evaluation_ticket_ids": ["ticket-evaluation-1"],
  "source_dataset_versions": ["source-demo.v1"],
  "training_ticket_ids": ["ticket-train-1"],
  "synthetic": true,
  "created_at": "2026-09-27T00:00:00Z"
}
